Name,Field(s),Dat,Notes
Bita Moghaddam,,"2,000",Iranian-American neuroscientist investigating the neuronal processes underlying emotion and cognition as a first step to designing strategies to treat and prevent brain illnesses
Lisa Mosconi,,,Italian American neuroscientist looking at the connections between perimenopause and Alzheimer's disease
Elly Nedivi,,1990,neuroscientist known for investigating the molecular mechanisms of neuroplasticity
Mary Lawson Neff,,1862-1945,neurologist remembered for investigating the effects of fatigue on mental and emotional health
Helen Neville,,1946-2018,"neuroscientist known for investigating human brain development, including neuroplasticity and neurolinguistics"
Sharlene Newman,,,"cognitive neuroscientists known for her work in neuroimaging,using magnetic resonance imaging techniques to study complex brain function,"
Sheila Nirenberg,,2010,neuroscientist working on neural coding and the development of prosthetic devices able to communicate directly with the brain
Kimberly Noble,,2011,neuroscientist and pediatrician researching socioeconomic disparities and children's cognitive development
Loraine Obler,,2010,neuroscientist
Kathie L. Olsen,,2000,neuroscientist noted for her work in scientific policy
Lauren Orefice,,2016,neuroscientist studying the role of peropheral nerves and sensory hypersensitivity in Autism-like behaviors
Sarah Pallas,,2005,neuroscientist known for cross-model plasticity and map compression studies in the visual and auditory cortical pathways
Audrey S. Penn,"Neuroscientist, Biologist, Chemist",1934,neurologist known for research in the biochemistry of muscle weakness in myasthenia gravis
Susan Perlman,,1949,neurologist and neurogeneticist investigating Friedreich's ataxia
Candace Pert,,1946-2013,"neuroscientist and pharmacologist known for discovering the opiate receptor, the cellular binding site for endorphins in the brain"
Laura-Ann Petitto,,1954,"cognitive neuroscientist known for her neurolinguistics research, including work on the language capacity of chimpanzees"
Marina Picciotto,,1963,"neuroscientist known for her work on the role of nicotine in addiction, memory, and reward behaviours"
Nicole Prause,,2000,"neuroscientist researching human sexual behaviour, addiction, and the physiology of sexual response"
Caroline Palavicino-Maggio,,2000,"neuroscientist exploring how gene expression in amine neurons and neural circuits leads to changes in social behavior, specifically aggression, in Drosophila"
Gina Poe,,2000,neuroscientist studying sleep and how neural activity during REM sleep is crucial to memory and learning
Nicole Prause,,1978,neursoscientist researching human sexual behavior
Elizabeth Quinlan,,2001,professor at the University of Maryland studying how the pasticity of juvenile and adult mammalian visual systems differ
Rosa Rademakers,,2016,neuroscientist researching the genetic basis of neurodegenerative diseases
Kanaka Rajan,,2000,neuroscientist researching how the brain processes sensory information
Priya Rajasethupathy,,2000,neuroscientist researching memory development over time by observing and manipulating neural circuitry.
Isabelle Rapin,,1927-2017,Swiss-American neurologist and paediatrician remembered for her contributions to the understanding of autism and language disorders.
Judith L. Rapoport,"Neuroscientist, psychiatrist",1960,"psychiatrist known for studying the clinical phenomenology, neurobiology, and treatment of Childhood Onset Schizophrenia."
Brenda Rapp neuroscientist and editor of Cognitive Neuropsychology,,,known for research into written word production and dysgraphia.
Linda Restifo,,1980,neuroscientist studying the changes in brain development leading to cognitive disorders.
Barbara Rothbaum,"Neuroscientist, psychologist ",1990,psychologist and pioneer in the treatment of anxiety-related disorders.
Vanessa Ruta,,2000,neuroscientist known for investigating chemosensory circuits behind innate and learned behaviours in the fly Drosophila melanogaster.
Carolyn I. Rodriguez,,2000,neuroscientist and psychiatrist developing rapid therapies for OCD and hoarding disorder.
Eleanor Saffran,,1939-2002,neuroscientist known as a researcher in the field of cognitive neuropsychology
Miriam Salpeter,,1929-2000,professor of neurobiology at Cornell University
Cara Santa Maria,"Neuroscientist, psychologist ",1983,science communicator and psychologist
Rebecca Saxe,,2000,"cognitive neuroscientist working on theory of mind, the plasticity of the cortex and the neural substrates of empathy, and emotion attribution"
Daniela Schiller,,1972,neuroscientist heading the Affective Neuroscience Lab at the Mount Sinai School of Medicine
Amita Sehgal,,1990,cell and molecular neuroscientist working on circadian rhythms and sleep
Dorothy P. Schafer,,2000,neurobiologist focusing on the role of microglia in the development of synapses and brain circuits
Erin Schuman,,1963,"neurobiologist studying neuronal synapses, director of the Max Planck Institute for Brain Research"
Nicole Schupf,,2000,"epidemiologist and neuroscientist, professor at the Gertrude H. Sergievsky Center, Columbia University Faculty of Medicine"
Carla J. Shatz,,1947,one of the pioneers who determined some of the basic principles of early brain development
Anne Schaefer,,2000,neuroscientist and neuroimmunologist who investigates the epigenetic mechanisms of cellular plasticity and their role in the regulation of microglia-neuron interactions
Erin M. Schuman,,1963,neurobiologist studying neuronal synapses
Rosalind A. Segal,,1958,neurobiologist studying the how disruption of the mammalian brain leads to the formation of brain malignancies
Maryam Shanechi,,1981,"Iranian-American neuroengineer, studying decoding of the brain's activity to control brain-machine interfaces"
Carla J. Shatz,,1947,early female neurobiologist who determined some of the basic principles of brain development
Pamela Sklar,"Neuroscientist, psychiatrist",1959-2017,psychiatrist and neuroscientist known for large-scale gene discovery studies in bipolar disorder and schizophrenia
Esther Somerfeld-Ziskind,,1901-2002,"neurologist and psychiatrist known for pioneering research into the use of insulin, lithium, and electroconvulsive therapy for treating psychiatric disorders"
Tara Spires-Jones,,2000,neuroscientist focusing on the degeneration of synapse connections between neuronal braincells in Alzheimer's disease
Beth Stevens,,1970,neuroscientist known for work on the role of microglia and complement proteins in the removal of synaptic cells during brain development
Lisa Stowers,,2004,neuroscientist at Scripps Research studying pheromone signaling and response
Carsen Stringer,,2000,computational neuroscientist and Group Leader at the Howard Hughes Medical Institute Janelia Research Campus. Stringer uses machine learning and deep neural networks to visualize large scale neural recordings and then probe the neural computations that give rise to visual processing in mice
Wendy Suzuki,,1990,neuroscientist researching neuroplasticity and how the brain is able to change and adapt over the course of a person's life
Susan Swedo,,,neuroscientist conducting research on the causes and treatment of pediatric neuropsychiatric disorders
Viviane Tabar,"Neuroscientist, Bioiogist",2000,neurosurgeon researching stem cell biology and strategies for cell-based therapies for the repair of radiation-induced brain injury
Paula Tallal,,1947,neuroscientist researching dyslexia and other word encoding disorders
Carol Tamminga,"Neuroscientist, psychiatrist",2000,"psychiatrist and neuroscientist focusing on treating psychotic illnesses, such as schizophrenia, psychotic bipolar disorder, and schizoaffective disorder"
Jill Bolte Taylor,,1959,neuroanatomist who wrote My Stroke of Insight
Sally Temple,,2000,"neuroscientist focusing on neural stem cells and therapies related to eye, brain, and spinal cord disorders"
Sujata Tewari,,1938-2000,Indian-American neuroscientist known for her work demonstrating that chronic alcohol consumption inhibits protein metabolism in the brains of mice
Jean H. Thurston,,1917-2017,neurologist known for her research on seizure disorders
Doris Tsao,,2000,systems neuroscientist known for pioneering fMRI with single-unit electrophysiological recordings and for discovering the macaque face patch system for face perception
Gina G. Turrigiano,,1990,neuroscientist researching cortical networks and stromograstic network function
Kay Tye,,1981,"neuroscientist focusing on optogenetics for identifying connections in the brain involved in innate emotion, motivation and social behaviours"
Malú G. Tansey,,,is a neuroscientist investigating the role of neuroimmune interactions in the development and progression of neurodegenerative and neuropsychiatric disease.
Lucina Uddin,,2000,cognitive neuroscientist researching the relationship between brain connectivity and cognition in typical and atypical development using network neuroscience approaches.
Leslie Ungerleider,,1946,experimental psychologist and neuroscientist known for introducing the concepts of the dorsal and ventral streams
Ashley Van Zeeland,,1982,"neuroscientist focusing on genomics, genetics, and biotechnology in the fields of autism and anorexia nervosa"
Joan Venes,,1935-2010,neurosurgeon known for helping to develop the practice of neurosurgery in children
Nora Volkow,,1956,Mexican-American psychiatrist and neuroscientist conducting imaging studies of the brains of people addicted to drugs
Leslie B. Vosshall,,1965,"neurobiologist known for contributions to olfaction, particularly the discovery and characterization of the insect olfactory receptor family"
Joni Wallis,,1990,neurophysiologist investigating how the frontal cortex of the brain is functionally organized to help people set and attain goals at the level of single neurons
Judith R. Walters,,2000,neuropharmacologist at the National Institute of Neurological Disorders and Stroke
Jade Wang,,1983,computer programmer and neuroscientist known as co-founder of the open source project Sandstorm
Kate Wassum,,2000,"neuroscientist and professor of behavioral neuroscience at the University of California, Los Angeles"
Nicole Weekes,"Neuroscientist, psychologist",2001,psychologist and neuroscientist studying the psychological and biological response to stress
Stephanie A. White,,2000,neuroscientist studying how social interactions impact the brain
Heather Williams,,1955,ornithologist known for her book Behavioral neurobiology of birdsong
Rachel Wilson,,2000,"neurobiologist working in the fields of electrophysiology, neuropharmacology, molecular genetics and functional anatomy"
Shari Wiseman,,2017,"neuroscientist, editor-in-chief of Nature Neuroscience"
Ilana B. Witten,,2000,"studies the midbrain dopaminergic reward circuitry, with a focus on the striatal neural circuit mechanisms driving reward learning and decision making"
Marina Wolf,,1998,neuroscientist studying the role of neuronal pasticity in drug addiction
Rachel Wong,,,"professor at University of Washington interested in neural circuit assembly in development,circuit disassembly in degeneration and circuit reassembly upon cellular regeneration whose urrent studies are based on the vertebrate retina of mice,human and non-human primates"
Teresa Wood,,2019,"neuroscientist, Fellow of the American Association for the Advancement of Science"
Catherine Woolley,,1965,neuroendocrinologist studying cellular and molecular neuroscience in relation to the brain and behaviour
Sarah M. N. Woolley,,2000,"neuroscientist studying the neuroscience of communication, using songbirds to understand how the brain learns and understands vocal communication"
Anne B. Young,,1970,"physician and neuroscientist working on neurodegenerative diseases, including Huntington's disease and Parkinson's disease"
Deborah Yurgelun-Todd,,2017,"neuropsychologist, director of the University pf Utah's Neuroscience Initiative"
Phyllis Zee,,2000,neurologist researching basic and translational sleep and circadian rhythm
Hongkui Zeng,,2006,"director of the Allen Institute for Brain Science, Seattle"
Huda Zoghbi,,1954,Lebanese-born American geneticist currently studying MECP2 and discovering that overexpressing the protein in mice led to an autism-like neurological disorder
Suzanne Zukin,,2009,"neuroscientist, studying glutamate receptors"
Gladys Maestre,,2000,"neuroscientist, University of Texas, known for work on Alzheimer's disease and dementia"