Name,Field(s),Dat,Notes
Jennifer S. Lund,,1940,anatomist focused on he organization of feedforward and feedback circuits in the neocortex
Giovanna Mallucci,,2000,neuroscientist specializing in neurodegenerative diseases
Ruth McKernan,,1980,neuroscientist known for her work on ligand-gated ion channels as well as for services to business and innovation
Katharine Montagu,,1966,first to identify dopamine in the human brain
Freda Newcombe,,1925-2001,clinical neuropsychologist playing a pivotal role in the development of cognitive neuropsychology
Esther Odekunle,,2010,neurobiologist and antibody engineer researching risks from antibodies
Karalyn Patterson,,1943,specialist in cognitive neuropsychology
Marysia Placzek,,2012,professor of developmental neurobiology at the University of Sheffield
Cathy Price,,1990,professor of cognitive neuroscience at University College London
Gina Rippon,,1950,"research involving the application of brain imaging techniques, particularly electroencephalography and magnetoencephalography"
Katya Rubia,,1994,neuroscientist best known for her work in child cognitive neuroscience and neuropsychiatry
Barbara Sahakian,,2000,"known for her contributions to psychopharmacology, neuroethics, neuropsychology, neuropsychiatry and neuroimaging"
Sophie Scott,,1966,"neuroscientist investigating the cognitive neuroscience of voices, speech and laughter"
Aditi Shankardass,,2009,clinical work using electroencephalogram recordings of the brain to diagnose developmental disorders in children
Rebeccah Slater,,2010,professor of paediatric neuroscience at the University of Oxford
Maria Grazia Spillantini,,1980,neuroscientist noted for identifying the protein alpha-synuclein as the major component of Lewy bodies
Tara Spires-Jones,,1976,neuroscientists studying synapse degeneration and resilience in Alzheimer's and other neurodegenerative diseases
Susan Standring,,1970,"experimental neurobiologist, writer and researcher"
Karen Steel,,1990,"geneticist studying the genetics behind deafness, mainly focusing on the genetics of mice"
Sarah Tabrizi,,1965,British-Iranian neurologist and neuroscientist in the field of neurodegeneration
Kathleen Taylor,,2000,"neuroscientist with a focus on physiology, psychology and the neuroscience of belief"
Irene Tracey,,1966,research focused on the neuroscience of pain perception and analgesia
Anne Treisman,,1935-2018,"cognitive psychologist researching visual attention, object perception, and memory"
Angela Vincent,,1942,"known for research in the areas of molecular biology, biochemistry, cellular immunology and intracellular neurophysiology"
Elizabeth Warrington,,1931,neuropsychologist specialised in the study of dementia
Heather Whalley,"Neuroscientist, psychiatrist",2010,psychiatrist with a research focus on the mechanisms underlying the development of major psychiatric disorders
Barbara Wilson,"Neuroscientist, psychologist ",1941,"psychologist, founder of the Oliver Zangwill Centre for Neuropsychological Rehabilitation, Ely, Cambridgeshire"
Emma Yhnell,,2015,neuroscientists with a research focus on Huntington's disease
Carmela Abraham,,1990,neuroscientist studying Alzheimer's disease
Susan Ackerman,"Neuroscientist, Bioiogist",2000,neuroscientist and geneticist known for investigating genetic and biochemical factors behind the central nervous system
Elizabeth Adkins-Regan,,1945,comparative behavioural neuroendocrinologist known for research on the hormonal and neural mechanisms of reproductive behaviour
Huda Akil,,1945,Syrian-American neuroscientist focusing on the neurobiology of emotions
Susan Amara,,2000,neuroscientist focusing on the parts of the brain activated by the effects of addictive drugs
Julia Tutelman Apter,,1979,One of the first specialists in neurophysiological research[1]
Nancy Coover Andreasen,,1938,neuroscientist and neuropsychiatrist known for developing the concept of negative symptoms in schizophrenia
Anne M. Andrews,,1990,neuroscientist focused on the neurochemistry of the brain's serotonin system
Amy Arnsten,,1980,neuroscientist focused on the molecular mechanisms behind the higher cortical circuits governing cognition
Ream Al-Hasani,,,"British-born American neuroscientist and pharmacologist studying endogenous opioids in addiction,pain,and affective disorders"
Kristin Baldwin,,1998,neuroecientist focusing on reprogrammed and induced pluripotent stem cells to study the epigenetic changes of the genome and brain
Tracy Bale,"Neuroscientist, Bioiogist",1969,neuroscientist and molecular biologist focusing on parental prenatal stress and its effect on offspring
Cornelia Bargmann,,1962,neurobiologist known for her work on the genetic and neural circuit mechanisms of behavior using C. elegans
Carol A. Barnes,,2000,neuroscientist focusing on the neurophysiological and behavioral changes that occur in the brain during ageing
Lisa Feldman Barrett,"Neuroscientist, psychologist ",1963,"psychologist and neuroscientist studying emotion, known for How Emotions are Made: The Secret Life of the Brain"
Susan R. Barry,,1981,neurobiologist and physician known for her Fixing My Gaze: A Scientist's Journey into Seeing in Three Dimensions
Jessica Barson,,2010,neuroscientist investigating neuropeptide signalling in the paraventricular nucleus of the thalamus
Danielle Bassett,,1981,physicist and systems neuroscientist applying network science to the study of learning in the human brain
Amy Bastian,,1968,neuroscientist contributing to the neuroscience of sensorimotor control
Diana Bautista,,2000,"neuroscientist known for her work on the molecular mechanisms underlying itch, touch and pain"
Elaine Bearer,,1990,"neuroscientist, pathologist and composer, recent research on magnetic resonance imaging of neural connections and brain activity in transgenic mouse models of human disorders"
Marlene Behrmann,"Neuroscientist, psychologist ",1959,psychologist specializing in the cognitive neuroscience of visual perception
Ursula Bellugi,,1931,German-American neuroscientist researching the biological bases of language
April A. Benasich,,1980,neuroscientist known for research on the early neural processes necessary for normal cognitive and language development
Joanne Berger-Sweeney,,1990,"neuroscientist researching the neurobiology of learning and memory, with applications to neurodevelopmental disorders"
Heather A. Berlin,,2000,neuroscientist noted for her work in science communication and outreach
Mayim Bialik,,1975,"actress, author and neuroscientist"
Staci Bilbo,,2000,neuroimmunologist and professor of psychology and neuroscience at Duke University
Sherilynn Black,,2010,neuroscientist at Duke University researching social neuroscience
Eliza Bliss-Moreau,,2008,neuroscientist focusing on the biology of emotions in humans and animals
Brenda Bloodgood,,2000,neuroscientist studying synaptic plasticity
Jill Bolte Taylor,,1959,"neuroanatomist, author, and inspirational public speaker, known for studying severe mental illnesses and her My Stroke of Insight, A Brain Scientist's Personal Journey"
Susan Y. Bookheimer,,2010,neuroscientist known for her work developing brain imaging techniques to help patients with Alzheimer's and related disease
Nancy Bonini,,1959,"neuroscientist and geneticist, known for pioneering the use of Drosophila to study neurodegeneration of the human brain"
Lisa Boulanger,,1990,research at Princeton University on immune proteins in the formation and function of neuronal connectivity
Mary Brazier,,1904-1995,British-born American neuroscientist known for her fundamental contributions to the study of EEG changes in anesthesia
Louann Brizendine,,1952,neuroscientist researching women's moods and hormones
Katja Brose,,2000,neuroscientist known for identifying the receptor Robo and its ligand Slit as a new family of axon guidance molecule
Linda B. Buck,,1947,"Nobel laureate, best known for her work on the olfactory system"
Elizabeth A. Buffalo,,2010,research into neurophysiology and the role of the hippocampus and medial temporal lobe structures in learning and memory
Mary Bartlett Bunge,,1941,neuroscientist researching a cure for paralysis
Denise Cai,,2010,researching memory formation at the Icahn School of Medicine at Mount Sinai
Patricia Carpenter,,2000,neuroscientist focusing on the organization of the cognitive systems in immediate thought
Mary Carskadon,,1990,investigating sleep disorders
C. Sue Carter,"Neuroscientist, Bioiogist",1990,biologist and behavioral neurobiologist specializing in behavioral neuroendocrinology
Vivien Casagrande,,1942-2017,neuroscientist known for her research on understanding how the visual thalamus and cortex interact to construct our perceptual world
Constance Cepko,,1982,neuroscientist researching retroviral vectors in studying the development of the retina
Gloria Choi,,2014,"neuroscientist at the Picower Institute for Leaning and Memory at MIT, researching the role of the immune system in autism spectrum disorder-like phenotypes"
Anne Churchland,,2000,neuroscientist studying the function of the posterior parietal cortex in cognitive processes
Patricia Churchland,,1943,Canadian-American philosopher focusing on the interface between neuroscience and philosophy
Uraina Clark,,2008,"neuroscientist, Icahn School of Medicine at Mount Sinai, researching functional magnetic resonance imaging to understand how stressors impact brain and behavior"
Martha Constantine-Paton,,2000,"neuroscientist focusing on synaptic plasticity and brain development, particularly visual development"
Suzanne Corkin,,1937-2016,"neuroscientist best known for her research on human memory, which she studied in patients with Alzheimer's disease, Parkinson's disease, and amnesia"
Seana Coulson,,2000,cognitive scientist researching the neurobiology of language
Jacqueline Crawley,,1970,neuroscientist known for developing tests including the three-compartment test to evaluate mouse social behaviour
Molly J. Crockett,,2010,neuroscientist studying the role of neurotransmitters on decision-making
Elizabeth C. Crosby,,1888-1983,neuroanatomist known for her outstanding contributions to comparative and human neuroanatomy
Meaghan Creed,,2000,neuroscientists known for pioneering research into understanding and applying deep brain stimulation to treat brain related diseases
Jessica Cardin,,2000,neuroscientist studying local circuits within the primary visual cortex to understand how cellular and synaptic interactions flexibly adapt to different behavioral states and contexts to give rise to visual perceptions and drive motivated behaviors.
Merit Cudkowicz,,2000,"is a Neurologist, Neuroscientist, and leading world expert in the study of amyotrophic lateral sclerosis"
Mary Fenner Dallman,,1935-2021,"neuroendocrinologist known for elucidating function along the hypothalamic, pituitary, adrenal axis"
Hanna Damasio,,1970,"neuroscientist known for using brain imaging methods, such as computerized tomography and nuclear magnetic resonance for diagnosing brain diseases"
Muriel Davisson,,1970,geneticist known for developing the Down syndrome mouse model Ts65Dn
Valina L. Dawson,,1961,neuroscientist researching the molecular mechanisms that lead to neuronal cell death in neurodegenerative diseases
Lindsay M. De Biase,,2000,explores the diversity of microglia that exist within the basal ganglia circuitry to one day target regional or circuit-specific microglia in disease
Christine Ann Denny,,2010,neuroscientist investigating the molecular mechanisms underlying learning and memory
Adele Diamond,,1952,co-founded the field of developmental cognitive neuroscience
Marian Diamond,,1926-2017,pioneering scientist and educator considered to be one of the founders of modern neuroscience
Zoe R. Donaldson,,2000,American neuroscientist exploring the neurobiological and genetic mechanisms of social bonding and social behavior in rodents
Dena Dubal,,2011,research showing that the hormone Klotho can enhance cognition and diminish neurodegenerative decline
Catherine Dulac,,,French-American neuroscientist researching the molecular biology of olfactory signaling in mammels
Susan Durham,,2010,"neurosurgeon, professor at the University of Southern California Keck School of Medicine"
Susan Dymecki,,1960,geneticist and neuroscientist at Harvard's Dymecki Lab
Emmeline Edwards,,2000,neurochemist researching neural mechanisms of complex behaviors
Gillian Einstein,,1952,neuroscientist focusing on the anatomy of the female brain
Judith S. Eisen,"Neuroscientist, Bioiogist",1951,"American neuroscientist and professor of biology at the University of Oregon who helped establish zebrafish as a model in which to study vertebrate nervous system development. Eisen conducts fundamental research in the specification and patterning of the vertebrate nervous system with a focus on developmental interactions between the nervous system, immune system, and host-associated microbiota"
Lise Eliot,,2000,"neuroscientist known for her book on gender differences, Pink Brain, Blue Brain: How Small Differences Grow into Troublesome Gaps and What We Can Do About It"
Karen Emmorey,,2010,linguist and cognitive neuroscientist investigating the neuroscience of sign language
Alev Erisir,,2000,Turkish-American neuroscientist researching synaptic connectivity in the visual and taste systems
Emily Falk,,2010,"American communication neuroscientist studying behavior change and the spread of ideas, with a focus on linking neural activity to individual, group, and population behavior"
Evelina Fedorenko,,1980,Russian-American cognitive neuroscientist
Eva Feldman,,1979,neurologist contributing to various areas of research including the diagnosis of diabetic neuropathy and the application of stem cell therapy for treating human diseases such as Alzheimer's
Marla Feller,"Neuroscientist, Bioiogist",1990,professor of biological sciences studying mechanisms underpinning the assembly of neural circuits
Ila Fiete,,2000,Indian-American computational neuroscientist
Susan Fiske,"Neuroscientist, psychologist ",1952,psychologist and neuroscientist known for work on social cognition at Princeton University
Shelly Flagel,,2000,"behavioral neuroscientist studying the individual differences in addiction and impulse control disorders, reward learning, and motivated behaviour neurobiology"
Alice Weaver Flaherty,,2000,"neurologist researching how human brains represent their bodies in relation to depression, Parkinson's, and somatoform disorders"
Joyonna Gamble-George,,2014,"neuroscientist, innovator and entrepreneur, researching the endocannabinoid system in stress-induced maladaptations of the brain"
Michela Gallagher,"Neuroscientist, psychologist ",2008,cognitive psychologist and neuroscientist at Johns Hopkins University
Sandra M. Garraway,,,is an American neuroscientist who studies the neural mechanisms of spinal nociceptive pain after spinal cord injury
Kathleen Gates,,2000,neuroscientist and quantitative psychologist developing statistical methods for the analysis of intensive longitudinal data
Lisa Genova,,1970,neuroscientist and writer known for her novel Still Alive about a professor with Alzheimer's disease
Morton Ann Gernsbacher,,1980,neuroscientist specializing in autism and psycholinguistics
Erin M. Gibson,,,is a glial and circadian biologist studying the molecular mechanisms by which the circadian rhythm modulates glial biology
Lisa Giocomo,,2012,neuroscientist investigating molecular and cellular mechanisms underlying cortical neural circuits
Erica Glasper,,2005,behavioral neuroscientist with a laboratory at the University of Maryland
Patricia Goldman-Rakic,,1937-2003,first to discover and describe the circuitry of the prefrontal cortex and its relationship to working memory
Miriam B. Goodman,,2000,neuroscientist working to develop of mechanistic model of sensation in C. elegans
Lisa Goodrich,,1969,neurobiologist specializing in the cellular and molecular mechanisms behind the development of neural circuits
Elizabeth Gould,,1962,neuroscientist focusing on adult neurogenesis in the hippocampus
Patricia A. Grady,,1990,"neuroscientist known for her books on hypertension, cerebrovascular permeability, vascular stress, and cerebral edema"
Michelle Gray,,,with a focus on neuron-glia interactions in HD
Ann Graybiel,,1942,neuroscientist specializing on the basal ganglia and the neurophysiology of habit formation
Carla Green,,1962,neurobiologist and chronobiologist studying studies the molecular mechanism of circadian rhythms in mammals
Sue T. Griffin,,1934,neuroscientist known for investigating the role of neuroinflammation in the pathogenesis of Alzheimer's disease
Theanne Griffith,,2011,neuroscientist studying mammalian thermosensation
Kalanit Grill-Spector,,2000,neuroscientist studying the structure and function of the human visual system with MRI
Chenghua Gu,,2007,"professor, Harvard Medical School, researching the blood-brain barrier"
Lisa Gunaydin,,,neuroscientist who helped discover and specializes in optogenetic technology
Melina Hale,,1998,neuroscientist studying zebrafish to understand how the brain communicates with muscles to generate movement
Marnie Halpern,,1956,molecular and systems biologist who has focused on studying how differences are established between the right and left sides of the developing brain
Michelle Hampson,,2010,associate professor of radiology and biomedical imaging at Yala University
Kristen Harris,,1954,neuroscientist studying the structure and function of synapses using 3D-electron microscopy
Mary Hatten,,1975,neuroscientist researching how neurons migrate in the brain
Kiralee Hayashi actress,,,"stuntwoman,gymnast and scientist who co-authored Brain surface parameterization using Riemann surface structure,"
Dena G. Hernandez,,2016,"neurogeneticist, head of genomic technologies at the National Institute on Aging"
Rachel Sarah Herz,"Neuroscientist, psychologist ",1990,psychologist and a cognitive neuroscientist known as an expert on the psychology of smell
Melissa Hines,,2000,neuroscientist studying the development of gender and how the interaction of prenatal and postnatal experience shapes brain development and behaviour
Susan Hockfield,,1951,neuroscientist known for pioneering the use of monoclonal antibody technology in brain research
Julianne Holt-Lunstad,"Neuroscientist, psychologist ",2010,psychologist and neuroscientist focusing on the long-term health effects of social connections and loneliness
Elaine Hsiao,"Neuroscientist, Bioiogist",,American biologist who investigates how “peripheral” changes in the immune system and resident microbiota impact the nervous system
Yasmin Hurd,,2000,neuroscientist studying addiction in people and animal models including changes caused by cannabis
Lisa James,"Neuroscientist, psychologist ",2009,clinical psychologist and neuroscientist at the University of Minnesota Medical School
Dorothea Jameson,"Neuroscientist, psychologist ",1920-1998,cognitive psychologist known for her contribution to the field of colour and vision
Lily Jan,,1947,Chinese-American neuroscientist known for breakthroughs in neurogenesis and cell fate specification and for studying ion channels
Patricia Janak,"Neuroscientist, psychologist ",1965,psychologist and neuroscientist contributing to the biological basis of behaviour in the context of associative learning
Charlene Drew Jarvis,,1941,scientific researcher and politician
Amishi Jha,"Neuroscientist, psychologist ",1998,psychologist and neuroscientist showing how mindfulness training improves numerous aspects of both cognitive and emotional health
Yishi Jin,,2003,"Chinese-American neurobiologist, professor at the Howard Hughes Medical Institute"
Crystal C. Watkins Johansson,,2000,neuroscientist and psychiatrist at the Johns Hopkins University School of Medicine
Elizabeth Jonas,,2013,professor of endocrinology and neuroscience at the Yale School of Medicine
Lataisia Jones,,2016,neuroscientist studying neurological disorders through molecular and systems biology
Theresa A. Jones,,1964,neuroscientist focusing on neural plasticity across the lifespan synaptic connectivity in adult animals following brain damage during skill learning
Nancy Kanwisher,,1958,cognitive neuroscientist known for discovering the fusiform face area and the arahippocampal place area
Leslie M. Kay,,1999,neuroscientist at the University of Chicago studying the neurophysiology of the olfactory bulb
Tara Keck,,1978,professor of neuroscience at University College London
JacSue Kehoe,,1935,neuroscientist studying the neurons of Aplysia californica and the post-synaptic nerve response
Ann E. Kelley,,1954-2007,neuroscientist specialized in the neuroscience of reward and behavior
Darcy Kelley,,1948,neurobiologist contributing to neuroethology
Mary B. Kennedy,"Neuroscientist, Biologist, Chemist",1947,biochemist and neuroscientist focusing on the molecular mechanisms of synaptic plasticity
Catherine Kerr,,2000,neuroscientist investigating the effects of body-based attention practices such as Tai Chi and mindfulness on the brain and nervous system
Kristen Knutson,,2000,neurologist known for research into the mortality rates of evening and morning types
Nancy Kopell,,1942,mathematician known from applying mathematical models to analyze the physiological mechanisms of brain dynamics
Nina Kraus,,2000,neuroscientist investigating the neural encoding of speech and music and its plasticity
Mary Jeanne Kreek,,1937-2021,neurobiologist specializing in the study and treatment of addiction
Leah Krubitzer,,1980,neuroscientist investigating how complex brains in mammals evolve from simpler forms
Patricia K. Kuhl,,1970,neuroscientist investigating early language and brain development and how young children learn
Marta Kutas,,1949,"cognitive neuroscientist known for discovering the N400, an event-related potential component typically elicited by unexpected linguistic stimuli"
Adrienne C. Lahti,,1995,Belgian-American neuroscientist at the University of Alabama at Birmingham
Story Landis,,1970,neurobiologist and former director of the National Institute of Neurological Disorders and Stroke at the National Institutes of Health
Lynn T. Landmesser,"Neuroscientist, Bioiogist",1943,"biological scientist known for developmental neuroscience research, particularly relating to the spinal cord and the formation of spinal motor circuits"
Maria Lehtinen,,2000,neuroscientist at the Harvard Medical School
Jerre Levy,"Neuroscientist, psychologist ",1938,psychologist and neuroscientist studying the relationship between the cerebral hemispheres and visual-oriented versus language-oriented tasks
Linda Liau,,2007,neurosurgeon and neuroscientist at the Daviid Geffen School of Medicine at UCLA
Christiane Linster,,1962,Luxembourg-American behavioural neuroscientist known for research into neuromodulation relating to learning and memory
Judy Liu,,2000,neuroscientist working on cortical malformations causing epilepsy
Margaret Livingstone,"Neuroscientist, Bioiogist",1950,neurobiologist known for her book Vision and Art: The Biology of Seeing
Jeanne Loring,,1950,development neurobiologist and geneticist studying several fields including the genomics and epigenetics of pluripotent stem cells
Victoria Luine,"Neuroscientist, psychologist ",2000,"psychologist, neurochemist and writer"
Beatriz Luna,,1999,developmental neuroscientist conducting neuroimaging research on the development of cognitive control
Misha Mahowald,,1963-1996,computational neuroscientist working in the field of neuromorphic engineering
Gail Mandel,,,her research is focused on understanding how neuronal cell identity is established and maintained
Eve Marder,,1970,experimental and computational neuroscientist known for her work on neural circuits in the crustacean stomatogastric nervous system
Bianca Jones Marlin,,2015,neuroscientist researching the epigenetic mechanisms that enable trauma experienced by parents to be passed on to rodent offspring
Abigail Marsh,"Neuroscientist, psychologist ",1976,"psychologist and neuroscientist, Georgetown University, director of the Laboratory on Social and Affective Neuroscience"
Deborah Mash,,1952,neurologist interested in the addiction-stopping capabilities of ibogaine
Mara Mather,"Neuroscientist, psychologist ",2000,psychologist researching ageing with a focus on the effect of emotion and stress on memory
Helen S. Mayberg,,1956,neurologist known for delineating abnormal brain function in patients with major depression using functional neuroimaging
Margaret McCarthy,,1958,neuroscientist and pharmacologist researching the neuroscience of sex differences
Susan McConnell,,1980,neurobiologist studying the development of neural circuits in the mammalian cerebral cortex
Louise McCullough,,2000,neurologist engaged in stroke research
Ann McKee,,1953,neuropathologist and expert in neurodegenerative disease
Edith Graef McGeer,,1923-2023,neuroscientist known for studying the prevention and treatment of Alzheimer's and other neurodegenerative diseases
BethAnn McLaughlin,,1968,neurologist researching neural stress responses and brain injury
Sara Mednick,"Neuroscientist, psychologist ",2000,psychologist researching the relationship between napping and performance
Kristina Micheva,,2010,Bulgarian-American neuroscientist at Stanford University
Vivienne Ming,,2000,theoretical neuroscientist and Artificial Intelligence expert
Nancy Minshew,"Neuroscientist, psychiatrist",2000,"psychiatrist and neurologist known for work on the cognitive, neurological, and genetic bases of autism"
Cecilia Moens,,,"faculty member at the Fred Hutchinson Cancer Research Center in Seattle,Washington. She uses zebrafish to study vertebrate brain development,"
Michelle Monje,,2000,neurologist investigating the molecular mechanisms for neurodevelopment and neuroplasticity
Lisa Monteggia,,2000,neuroscientists investigating molecular mechanisms underlying neurotrophin interactions with antidepressants
